{
  "id": "map.round-01-grid",
  "name": "方格试炼场 · 示例魔改（mods/example）",
  "tileSize": 48,
  "columns": 16,
  "rows": 9,
  "tileTypes": {
    ".": { "color": "#4d3a2e", "solid": false },
    "~": { "color": "#6e5340", "solid": false },
    "#": { "color": "#a68a6a", "solid": true }
  },
  "grid": [
    "################",
    "#..............#",
    "#.##.######.##.#",
    "#.#..........#.#",
    "#.#.###..###.#.#",
    "#....##~~##....#",
    "#.##.######.##.#",
    "#..............#",
    "################"
  ],
  "playerStart": { "col": 7, "row": 7 }
}
